{
  "schema_version": "v2.0",
  "character_id": "jasmine",
  "character_name": "Jasmine",
  "description": "24-year-old East Asian (Japanese-Korean blend) virtual influencer with strong hourglass voluptuous figure",
  "visual_reference": "Connie Perignon aesthetic (bold sensual style, exaggerated hourglass proportions)",
  "anatomical_metrics": {
    "height_cm": 163,
    "weight_kg": 52,
    "body_type": "strong hourglass / voluptuous",
    "measurements": "32DDD-23-36"
  },
  "facial_features": {
    "face_shape": "soft oval",
    "distinctive_marks": []
  },
  "skin_and_markings": {
    "tattoos": [],
    "freckles": null,
    "scars": [],
    "birthmarks": []
  },
  "content_ceiling": {
    "max_level": "non-nude NSFW edge",
    "allowed": ["deep cleavage", "micro-bikini", "sheer lingerie", "sensual poses", "wet skin", "bedroom/fantasy settings"],
    "hard_limits": ["nudity", "topless", "genital exposure"]
  },
  "style_guidelines": {
    "primary_aesthetic": "fashion-forward, gym-fit, high-heat GFE",
    "platforms": {
      "instagram": "SFW suggestive only",
      "fanvue": "edge-pushing non-nude NSFW"
    }
  }
}
